{
  "_note": "Published source-freshness registry. Curated INPUT, in the same sense as data/curation_overrides.json — reviewed, hand-authored, and read by the build; NOT a generated corpus artifact. Shape: schema/source_freshness.schema.json. Field reference: docs/DATA_DICTIONARY.md. THREE COPIES EXIST AND ONLY ONE IS THIS ONE: (1) refresh-state:ingest/_state/source_health.json is the authoritative machine counter, unreviewed by design (D5); (2) main:ingest/_state/source_health.json is a bootstrap fallback that goes stale BY DESIGN (D5, accepted advisory); (3) this file is the reviewed publication. The build reads THIS file. A build that read (2) would republish a deliberately-stale artifact as current — the exact failure class this registry exists to close.",
  "observed_at": "2026-07-12",
  "observed_from": "main:ingest/_state/source_health.json",
  "coverage": {
    "tracked": ["aiaaic_sheet", "airi_navigator", "cisa_kev", "oecd_aim"],
    "note": "Covers only the four sources counted in ingest/_state/source_health.json: AIAAIC (aiaaic_sheet), OECD AIM (oecd_aim; refreshed weekly but its inputs are held under the OECD/AIID freeze), CISA KEV (cisa_kev), and AIRI Navigator (airi_navigator), which is RETIRED as of 2026-10-13 (D108; D124 records that D108 resolves the D57 hold) and is no longer fetched or refreshed; its rows are kept and marked stale. Every other input has no health tracking and is NOT represented here: the AIID snapshot (ingest/aiid_full.json; refreshed weekly under D114, but it has no health counter), the NVD/GHSA/OSV enrichment caches, the ATLAS / AVID / garak / promptfoo / red-team imports, and data/legacy_consolidated.json. Absence from this registry is NOT a freshness claim about a source — it means nothing is measured, which is a gap, not a clean bill of health."
  },
  "sources": {
    "aiaaic_sheet": {
      "label": "AIAAIC Repository (public incidents sheet)",
      "status": "ok",
      "last_success": "2026-07-12",
      "row_marker": { "kind": "tag", "value": "aiaaic-sheet" },
      "note": "The sheet-ingested rows only. Hand-curated AIAAIC-derived rows carry the broader `aiaaic` tag without `aiaaic-sheet` and are not emitted by this ingest, so they are correctly outside this selector."
    },
    "airi_navigator": {
      "label": "MIT AI Risk Initiative — AI Incident Tracker (AIRI Navigator)",
      "url": "https://airi-navigator.com/",
      "status": "stale",
      "last_success": "2026-05-31",
      "stale_since": "2026-06-07",
      "row_marker": { "kind": "tag", "value": "airi-navigator" },
      "hold": {
        "decision": "D57",
        "until": "2027-01-07",
        "note": "User ruling D57 (2026-10-09), option A of docs/audits/airi-navigator-sunset-memo-2026-10-09.md: keep all rows frozen and marked stale, no tombstones, no count change; re-decide (retire / replace / restore / keep) by this date, 90 days on. Resolved earlier if MIT replies to the sanctioned-export request sent 2026-07-29 or a sanctioned bulk channel reappears. Supersedes the D8 hold (until 2026-08-28), which lapsed with no recorded decision and was closed by D57. Rows inherit this date as source_freshness.review_by. UPDATE 2026-10-13 (user ruling D124): board ruling D108 retired this source on 2026-10-13 and thereby RESOLVES the D57 re-decide question (answer: retire). The rows stay, marked stale; no tombstones, no count change. `until` is deliberately left at 2027-01-07 and is now the date to re-check whether the site has returned, not an open retire/replace decision; leaving it unchanged keeps every row marker byte-identical (the schema requires a hold on every stale source, and rows inherit review_by from it). The MARKING (this registry entry and the row markers it drives) never depended on any reply and is not part of the hold."
      },
      "note": "RETIRED 2026-10-13 (D108): no longer fetched and no longer alerting. The registry status stays `stale` because retirement is not a freshness value (schema) and the rows are exactly as stale as before. The public bulk download was withdrawn; refreshes have 404'd since 2026-06-07. The corpus did not shrink and will not, because ingest/airi_navigator_incidents.json is a COMMITTED SNAPSHOT that re-feeds the same rows on every build — frozen, not broken. That is precisely why these rows read as current without anything in the data being false, and why freshness had to become its own published axis rather than a value of `source_status`. The EU AI Act risk-tier tags (`eu-ai-act-*`) on these rows are AIRI-derived and are current as of `last_success`, not as of the build date; they are deliberately kept, not stripped (D8)."
    },
    "cisa_kev": {
      "label": "CISA Known Exploited Vulnerabilities catalog",
      "url": "https://www.cisa.gov/known-exploited-vulnerabilities-catalog",
      "status": "ok",
      "last_success": "2026-07-12",
      "row_marker": null,
      "row_marker_note": "Enrichment-only, and deliberately non-propagating. KEV creates no entries and stamps no tag; it sets `exploited_in_wild` / `kev_date_added` on entries other sources created. If KEV went stale the consequence would be MISSING exploitation flags on rows we cannot enumerate, so marking the handful of rows that DO carry KEV data would point the reader at exactly the wrong set. Its freshness is therefore reported here, at source level, and nowhere else."
    },
    "oecd_aim": {
      "label": "OECD AI Incidents Monitor (AIM)",
      "url": "https://oecd.ai/en/incidents",
      "status": "ok",
      "last_success": "2026-07-12",
      "row_marker": { "kind": "tag", "value": "oecd-aim" }
    }
  }
}
